{
  "schema_version": 1,
  "id": "constantinople_1200",
  "title": "Constantinople · circa 1200",
  "subtitle": "An independent city experience",
  "reference_year_ce": 1200,
  "approximation_notice": "Original interpretive reconstruction. Landmark identities follow sources; coastline, relief, street plots, ordinary buildings and many monument dimensions are authored approximations. No survey accuracy, complete historical reconstruction, population or economic simulation is claimed.",
  "coordinate_system": {
    "axes": "east_north_up",
    "units": "metres",
    "origin_name": "Hagia Sophia vicinity",
    "modern_anchor_latitude_deg": 41.0086666667,
    "modern_anchor_longitude_deg": 28.9801666667,
    "source_id": "asce_hagia_sophia",
    "surveyed": false
  },
  "site": {
    "boundary_m": [
      [
        -6700,
        -2350
      ],
      [
        -5650,
        -2110
      ],
      [
        -4750,
        -1890
      ],
      [
        -3650,
        -1730
      ],
      [
        -2650,
        -1520
      ],
      [
        -1760,
        -1360
      ],
      [
        -800,
        -1120
      ],
      [
        170,
        -955
      ],
      [
        650,
        -600
      ],
      [
        830,
        -60
      ],
      [
        830,
        650
      ],
      [
        580,
        1120
      ],
      [
        120,
        1370
      ],
      [
        -740,
        1570
      ],
      [
        -1560,
        1830
      ],
      [
        -2360,
        2180
      ],
      [
        -3090,
        2640
      ],
      [
        -3700,
        3210
      ],
      [
        -4260,
        3650
      ],
      [
        -6700,
        4200
      ]
    ],
    "hills": [
      {
        "position_m": [
          0,
          280
        ],
        "height_m": 37,
        "radius_m": 840
      },
      {
        "position_m": [
          -880,
          260
        ],
        "height_m": 49,
        "radius_m": 1000
      },
      {
        "position_m": [
          -1800,
          570
        ],
        "height_m": 59,
        "radius_m": 1050
      },
      {
        "position_m": [
          -3080,
          1050
        ],
        "height_m": 69,
        "radius_m": 1200
      },
      {
        "position_m": [
          -3730,
          2050
        ],
        "height_m": 64,
        "radius_m": 1000
      },
      {
        "position_m": [
          -4400,
          2650
        ],
        "height_m": 67,
        "radius_m": 950
      },
      {
        "position_m": [
          -4030,
          -550
        ],
        "height_m": 57,
        "radius_m": 1250
      }
    ],
    "sea_level_m": 0,
    "base_height_m": 4,
    "coast_falloff_m": 130,
    "western_land_edge_m": -6700,
    "generation": {
      "seed": 12001003,
      "max_buildings": 40000,
      "max_trees": 4200,
      "tree_attempts": 10500,
      "coast_clearance_m": 26,
      "road_setback_m": 3,
      "wall_setback_m": 15,
      "landmark_margin_m": 22,
      "house_gap_m": 1.3,
      "lane_every_x": 8,
      "lane_every_y": 9,
      "lane_width_m": 4.5
    },
    "context_land": [
      {
        "id": "galata_north_shore",
        "name": "Galata and the northern European shore",
        "polygon_m": [
          [
            -6700,
            4600
          ],
          [
            -4600,
            4350
          ],
          [
            -3820,
            4030
          ],
          [
            -3100,
            3440
          ],
          [
            -2220,
            2930
          ],
          [
            -1450,
            2600
          ],
          [
            -740,
            2310
          ],
          [
            120,
            2110
          ],
          [
            650,
            2120
          ],
          [
            1120,
            2380
          ],
          [
            1450,
            2860
          ],
          [
            1750,
            3650
          ],
          [
            2400,
            5200
          ],
          [
            3700,
            9000
          ],
          [
            -6700,
            9000
          ]
        ],
        "base_height_m": 7,
        "coast_falloff_m": 170,
        "hills": [
          {
            "position_m": [
              -300,
              3700
            ],
            "height_m": 95,
            "radius_m": 1900
          },
          {
            "position_m": [
              -2900,
              4700
            ],
            "height_m": 110,
            "radius_m": 1700
          },
          {
            "position_m": [
              1800,
              6300
            ],
            "height_m": 125,
            "radius_m": 2400
          }
        ],
        "evidence": "Broad geography only: Galata lies across the Golden Horn and Asia across the Bosphorus. This polygon, relief and vegetated silhouette are original approximate authoring values, not a coastline survey or a reconstructed 1200 settlement. No modern skyline is represented.",
        "source_ids": [
          "columbia_geography",
          "walters_galata_view"
        ]
      },
      {
        "id": "asian_bosphorus_shore",
        "name": "Asian shore beyond the Bosphorus",
        "polygon_m": [
          [
            4500,
            -6000
          ],
          [
            3200,
            -3700
          ],
          [
            2900,
            -2100
          ],
          [
            3050,
            -550
          ],
          [
            2800,
            500
          ],
          [
            2950,
            1900
          ],
          [
            3450,
            3000
          ],
          [
            4000,
            3850
          ],
          [
            4200,
            5600
          ],
          [
            5000,
            9000
          ],
          [
            10000,
            9000
          ],
          [
            10000,
            -6000
          ]
        ],
        "base_height_m": 8,
        "coast_falloff_m": 220,
        "hills": [
          {
            "position_m": [
              4700,
              -2500
            ],
            "height_m": 100,
            "radius_m": 1800
          },
          {
            "position_m": [
              5100,
              1100
            ],
            "height_m": 140,
            "radius_m": 2200
          },
          {
            "position_m": [
              6500,
              5000
            ],
            "height_m": 185,
            "radius_m": 2700
          }
        ],
        "evidence": "Broad geography only: Galata lies across the Golden Horn and Asia across the Bosphorus. This polygon, relief and vegetated silhouette are original approximate authoring values, not a coastline survey or a reconstructed 1200 settlement. No modern skyline is represented.",
        "source_ids": [
          "columbia_geography"
        ]
      }
    ]
  },
  "roads": [
    {
      "id": "mese",
      "points_m": [
        [
          -5449.864,
          -1594.405
        ],
        [
          -5384.916,
          -1597.003
        ],
        [
          -5339.952,
          -1598.802
        ],
        [
          -5255.02,
          -1602.199
        ],
        [
          -4490,
          -920
        ],
        [
          -3650,
          -550
        ],
        [
          -2780,
          -330
        ],
        [
          -2100,
          -150
        ],
        [
          -1480,
          -95
        ],
        [
          -795,
          -140
        ],
        [
          -190,
          -160
        ],
        [
          80,
          -110
        ]
      ],
      "width_m": 23,
      "evidence": "Interpretive route joining urban anchors; width and bends are authored. The gate approach crosses both authored wall lines perpendicular to the modeled portal; its alignment is interpretive."
    },
    {
      "id": "northern_branch",
      "points_m": [
        [
          -2780,
          -330
        ],
        [
          -2900,
          620
        ],
        [
          -3120,
          1160
        ],
        [
          -3770,
          1900
        ],
        [
          -4380,
          2570
        ],
        [
          -4260,
          3120
        ]
      ],
      "width_m": 18,
      "evidence": "Interpretive route joining urban anchors; width and bends are authored."
    },
    {
      "id": "golden_horn_shore",
      "points_m": [
        [
          580,
          1110
        ],
        [
          -520,
          1300
        ],
        [
          -1450,
          1620
        ],
        [
          -2180,
          1920
        ],
        [
          -3000,
          2450
        ],
        [
          -3670,
          3000
        ],
        [
          -4250,
          3350
        ]
      ],
      "width_m": 16,
      "evidence": "Interpretive route joining urban anchors; width and bends are authored."
    },
    {
      "id": "marmara_shore",
      "points_m": [
        [
          -5200,
          -1760
        ],
        [
          -4400,
          -1590
        ],
        [
          -3650,
          -1510
        ],
        [
          -2730,
          -1300
        ],
        [
          -1800,
          -1150
        ],
        [
          -810,
          -950
        ],
        [
          180,
          -760
        ],
        [
          625,
          -350
        ]
      ],
      "width_m": 13,
      "evidence": "Interpretive route joining urban anchors; width and bends are authored."
    },
    {
      "id": "cathedral_approach",
      "points_m": [
        [
          -750,
          530
        ],
        [
          -420,
          300
        ],
        [
          -210,
          150
        ],
        [
          20,
          180
        ],
        [
          320,
          520
        ]
      ],
      "width_m": 17,